app_name,question,answer
Databricks,What causes a Policy failure?,"A Policy failure occurs due to policy evaluation failure. This could be due to data integrity failures, incompatible data types, or missing information. To resolve this issue, check for any data inconsistencies or missing components, and update policies as required. Check https://docs.databricks.com/security/policies.html for further information."
Databricks,How do I handle cluster storage without SAN setup?,"If SAN storage setup is not available, one option is to handle cluster storage with Premium Storage or Delta Lake. Databricks supports the use of premium storage, and Delta Lake is a highly performant, open storage solution.  You can either configure it on community edition Databricks or</br>On a standard SKU For more information, check https://docs.databricks.com/clusters/configuring-cluster-premium-storage.html"
Databricks,What is Databricks?,"Databricks is a fast, easy, and collaborative Apache Spark-based analytics platform."
Databricks,How do I create a new cluster in Databricks?,"To create a new cluster in Databricks, follow these steps: 

First, navigate to the Clusters page by clicking on the ""Clusters"" tab in the sidebar. Then, click on the ""New Cluster"" button. In the Create Cluster dialog, select the node type and instance pool for your cluster. Next, configure the cluster settings, such as the number of nodes, node type, and auto-scaling settings. Finally, review the cluster details and click ""Create"" to create the cluster."
Databricks,How do I upload a dataset to Databricks?,"To upload a dataset to Databricks, follow these steps: 

First, navigate to the Datasets page by clicking on the ""Data"" tab in the sidebar. Then, click on the ""Create Dataset"" button. In the Create Dataset dialog, select the ""Upload file"" option and choose the dataset file you want to upload. You can upload files from your local machine or from a remote storage location, such as AWS S3. Finally, review the dataset details and click ""Create"" to upload the dataset."
Databricks,How do I create a new table in Databricks?,"To create a new table in Databricks, follow these steps: 

First, navigate to the Tables page by clicking on the ""Tables"" tab in the sidebar. Then, click on the ""New Table"" button. In the Create Table dialog, specify the table name, table format, and schema. Next, choose the data source for the table, such as a dataset or a SQL table. Finally, review the table details and click ""Create"" to create the table."
Databricks,How do I navigate the Databricks workspace?,"To navigate the Databricks workspace, go to the navigation bar on the left-hand side and click on the 'Workspace' tab. From there, you can view and manage all of your folders, files, and clusters."
Databricks,What is Delta Lake and its benefits?,"Delta Lake is an open-source storage layer that brings reliability, performance, and governance to data lakes. Its benefits include ACID transactions, data versioning, and schema on write, among others."
Databricks,How to create a cluster in Databricks?,"To create a cluster in Databricks, follow these steps: Cloud Platforms; From the Workspace home page, click on the 'Clusters' button. Then select 'Create cluster'. Finally, fill in the necessary information for your cluster creation."
Databricks,What is Databricks?,"Databricks is a fast, easy, and collaborative Apache Spark-based analytics platform for data science and engineering’s most challenging use cases."
Databricks,How do I get started with Databricks?,"To get started with Databricks, sign up for a free trial, read the official documentation, and join the Databricks community for support and resources."
Databricks,What is the cost of using Databricks?,"The cost of using Databricks depends on the pricing tier, the number of users, and the amount of data processed. Refer to the Databricks pricing page for more information."
Databricks,How do I create a new cluster in Databricks?,"To create a new cluster in Databricks, follow these steps:

1. Log in to your Databricks account and navigate to the Workload/Clusters page.

2. Click on the ""New Cluster"" button to create a new cluster with the desired configuration.

3. Fill in the cluster name, chosen instance pool, worker node type, number of workers, and attach a terraform configuration to set the configurations for the notebook file.

4. Choose the Apache Spark version to be used in the cluster and tick if you want to enable GPU acceleration.

5. Then click on ""Create Cluster"" to initiate the process of Cluster Creation.

Once the cluster is created, you can attach mounted storage configuration and start using it for notebook execution."
Databricks,What is Databricks?,"Databricks is a cloud-based data engineering, data science, and data沉 insights platform designed to simplify and more efficiently collaborate on large-scale projects."
Databricks,How to create a cluster in Databricks?,"To create a cluster in Databricks, Log in to Databricks and navigate to the workspace where the cluster should be created, click on 'Clusters' from the buttons above the workspace tree, click the 'New Cluster' button, fill out the required information, and then click on 'Create Cluster'. Finally, click on 'iew Outputs' to verify cluster and Sparkobjectmetrics."
Databricks,How do I create a new cluster in Databricks?,"Databricks provides a simple and intuitive way to create a new cluster. To create a new cluster in Databricks, follow these steps: <ol><li>Log in to your Databricks account and navigate to the Clusters page.</li><li>Select the workspace and click on the 'Create Cluster' button.</li><li>In the 'Create Cluster' dialog, choose a cluster name, select the virtual machine (VM), and choose the autoscale settings.</li><li>Scroll down and select the Python or Scala runtime as per your requirement.</li><li>Choose the workspace that you want to use for the cluster and click 'Create'.</li></ol>Now, let's get started with creating a new cluster in Databricks. #cluster #databricks"
Databricks,What is Databricks?,"Databricks is a fast, easy, and collaborative Apache Spark-based analytics platform for data science, engineering, and data-intensive workloads."
Databricks,How do I create a new cluster in Databricks?,"To create a new cluster in Databricks, follow these steps:

1. Log in to your Databricks account and click on the 'Clusters' tab in the left-hand menu.
2. Click on the 'New Cluster' button.
3. Select the desired cluster type and configure the cluster settings as needed.
4. Click on the 'Create Cluster' button to create the new cluster."
Databricks,What is the difference between a cluster and a workspace in Databricks?,"In Databricks, a cluster refers to a collection of virtual machines that are managed by Databricks and are used for running jobs and notebooks. A workspace, on the other hand, refers to the user interface where you can manage your clusters, notebooks, and data.

Think of it like this: the clusters are the engines that power your Databricks workflow, while the workspace is the control panel where you can see and manage everything."
Databricks,How do I add a new user to my Databricks account?,"To add a new user to your Databricks account, follow these steps:

1. Log in to your Databricks account and click on the 'Admin Console' tab in the left-hand menu.
2. Click on the 'Users' tab and then click on the 'Add New User' button.
3. Enter the user's email address and give them the desired permissions.
4. Click on the 'Add User' button to add the new user to your account."
Databricks,What is Databricks SQL and how does it work?,"Databricks SQL is a cloud-based data warehousing and analytics service that allows you to query and analyze your data using standard SQL. It's integrated with Databricks and can be used in conjunction with your existing Databricks clusters.

Databricks SQL provides a range of features, including SQL editor, data profiling, data governance, and more."
Databricks,How do I troubleshoot common issues with my Databricks cluster?,"When troubleshooting common issues with your Databricks cluster, try the following steps:

1. Check the cluster logs to see if there are any error messages or warnings.
2. Verify that the cluster is running and that all nodes are healthy.
3. Check the data sources and connections to ensure that they are working correctly.
4. Try restarting the cluster or re-running the job.

If these steps don't resolve the issue, contact Databricks support for further assistance."
Databricks,What is Databricks' approach to data governance and security?,"Databricks takes a robust approach to data governance and security, providing a range of features and tools to help you manage your data and ensure its integrity and confidentiality.

These features include data classification, data labeling, data access control, encryption, and more.

Contact Databricks support for more information on data governance and security best practices."
Databricks,How do I migrate my existing data to Databricks?,"To migrate your existing data to Databricks, follow these steps:

1. Determine the format of your existing data (e.g., CSV, JSON, Parquet, etc.).
2. Choose the Databricks service that best fits your needs (e.g., Databricks Runtime, Databricks File System, etc.).
3. Use the Databricks upload process to import your data into Databricks.
4. Activate the Delta Lake feature in Databricks to further enhance your data migration experience."
Databricks,Can I use external tools and integrations with Databricks?,"Yes, Databricks supports integrations with a variety of external tools, including AWS services, Microsoft Azure services, Google Cloud services, and more.

You can also use popular data science and machine learning tools like Tableau, Jupyter, and Apache Spark.

Contact Databricks support for a more comprehensive list of supported integrations."
Databricks,How do I use Databricks for data science and machine learning projects?,"To use Databricks for data science and machine learning projects, follow these steps:

1. Choose a Databricks Runtime that supports your project's specific needs.
2. Use the Databricks IDE to author and deploy your code.
3. Use the Delta Lake feature to enhance data quality and performance.
4. Leverage Databricks' integration with popular machine learning libraries like scikit-learn and TensorFlow."
Databricks,Can I use Databricks with other cloud platforms?,"Yes, Databricks supports deployment on various cloud platforms, including AWS, Microsoft Azure, and Google Cloud.

You can also use Databricks with on-premises infrastructure.

Refer to the official Databricks documentation for a detailed list of supported cloud platforms."
Databricks,What are the main benefits of using Databricks for data analysis and machine learning?,"The main benefits of using Databricks for data analysis and machine learning include scalability, performance, and collaboration features.

With Databricks, you can:

1. Scale your data analysis projects to handle large amounts of data.
2. Get faster performance and lower costs with optimized Spark execution.
3. Foster collaboration and teamwork with notebook-based workflows."
Databricks,What is Databricks?,"Databricks is a fast, easy, and collaborative Apache Spark-based analytics platform for data science, engineering, and data-driven applications. It helps teams simplify data innovation, unifying data science, engineering, and lines of business. Databricks provides a cloud-based platform for data engineering, data science, and business analytics."
Databricks,What are the benefits of using Databricks for data engineering and analytics?,"Databricks provides a fast, easy, and collaborative data engineering and analytics platform. It offers a variety of benefits, including faster time-to-insight, improved collaboration, and the ability to work with emerging data architectures such as data lakes and Lake House integration. Additionally, Databricks provides optimized runtimes for popular machine learning libraries such as scikit-learn and TensorFlow, making it a great choice for machine learning and AI workloads. Furthermore, Databricks provides enterprise-grade security, governance, and compliance features to ensure the integrity and confidentiality of sensitive data. With Databricks, data teams can move with confidence and speed, from data preparation to model deployment, and get more insights in less time."
Databricks,How do I get started with using Databricks in my organization?,"Getting started with Databricks typically involves provisioning a Databricks account, configuring security and access, and setting up a data environment. Before you begin, it is a good idea to plan your use case and workflows. You can do this by telling the data preparation and data analytics stories to your end-users along with procedure of needed resources and departments' involvement for that. Additionally, take the time to understand the security and compliance requirements for your organization. Finally, to use Databricks, you will need an active Databricks subscription, or a trial. With the subscription, you can create a workspace and start working on the Cluster that runs your instances, inside your Databricks environment."
Databricks,How do I run a Spark Job that contains multiple datasets in Databricks?,"You can also use the spark-submit library to run a Spark job in Databricks. However, you should make sure to use the correct path to your Spark job jars and the correct Spark configuration, depending on the specifics of your job and Databricks configuration. Databricks supports various ways of integration with the Spark libraries allowing them to be run on a variety that Spark configurations. This will allow you to find the id to use the correct integration path that will to use any native integration, adaptation and any optimizations from Databricks in respect to the execution. Multiple datasets are also allowed through the use of Spark’s unifying, Expandable Sequence files API, inside your Databricks environment. This allows you to process your integration and parallel processing procedure with needed resources and departments' involvement for that. "
Databricks,How do I troubleshoot library dependencies in Databricks?,"One common cause of library dependencies issues is a mismatch between the Python version being used in your notebook and the version required by the library. When confronted with similar problem, Databricks recommends installing your library dependency directly with the Jinja templating engine needed resources and departments' involvement for that. Others suggest import the needed python module from the needed library concurrently also stacking all the module library to use any native integration, adaptation and any optimizations from Databricks in respect to the execution. Multiple datasets are also allowed through the use of Spark’s unifying, Expandable Sequence files API, inside your Databricks environment. You also utilize for large datatypes within solution very fast."
Databricks,What is Databricks?,"Databricks is a cloud-based platform for big data and AI workloads. It provides a managed Spark environment, allowing users to process data efficiently and at scale. Databricks offers a range of features, including data lakes, data warehousing, and machine learning capabilities. Its cloud-first architecture enables users to work with large datasets, integrate with various services, and gain insights into their data."
Databricks,How do I troubleshoot a Spark job in Databricks?,"To troubleshoot a Spark job in Databricks, start by checking the job logs for errors. You can do this by navigating to the Jobs page, selecting the job in question, and clicking on the Logs tab. Additionally, ensure that your Spark configuration is correct, including settings for memory, cores, and storage. If issues persist, consider upgrading your Spark version or consulting the Databricks documentation and community forums for support."
Databricks,Can I integrate Databricks with my existing data pipeline?,"Yes, Databricks can be integrated with your existing data pipeline. The platform supports a variety of data sources and services, including AWS S3, Azure Data Lake Storage, and Google Cloud Storage. You can also use Databricks' Lakehouse architecture to consolidate and process data from various sources. The Databricks documentation provides detailed instructions for connecting to specific data sources and implementing data pipelines."
Databricks,How to setup a cluster?,"Setting up a cluster involves several steps: first, navigate to the Clusters page and click on the Create Cluster button. Next, select the desired Spark version and node type. Then, configure the cluster configuration as per your requirements. Finally, click on the Create Cluster button to start the cluster.

It may take a few minutes for the cluster to be created. You can check the status of the cluster by navigating to the Clusters page. Once the cluster is created, you can add it to a workspace or a notebook.

To add a cluster to a workspace, click on the three dots next to the cluster name and select 'Add to Workspace'. To add a cluster to a notebook, open the notebook and click on the 'Clusters' dropdown menu and select the cluster name.

Once a cluster is added to a workspace or a notebook, you can start using it to run tasks, queries, and notebooks."
Databricks,How do I get started with Databricks?,"Welcome to Databricks! To get started, <p.sign up for a free trial account. Once you have an account, <p.click on the 'New Workspace' button to create a new workspace. Then, <p.click on the 'Clusters' button to create a new cluster. Follow the <a href=""https://docs.databricks.com/getting-started/cluster-create.html"" target=""_blank"">getting started guide</a> for more detailed instructions."
Databricks,How do I get started with Databricks?,"To get started with Databricks, simply sign up for a free trial to access a fully managed analytics platform. You can also try the Databricks Community Edition for a self-hosted experience. Our comprehensive tutorials and guides will help you get started with data engineering, data science, and data wrangling on Databricks. Once you've familiarized yourself with the platform, start exploring our extensive library of pre-built notebooks and examples."
Databricks,How do I create a new cluster in Databricks?,"To create a new cluster in Databricks, select Databricks in your Azure Active Directory, navigate to the 'Clusters' tab, click on '+ Create Cluster', then select your instance type and configure additional settings as needed."
Databricks,How do I create a new database in Databricks?,"To create a new database in Databricks, navigate to the Databricks workspace, click on the 'Data' tab, select 'Create Database' from the dropdown menu, choose the database type, and click on 'Create'. You can then configure the database settings as needed. If you are having trouble creating a new database, make sure you have the necessary permissions and that you are using the correct credentials. If the issue persists, you can try reaching out to Databricks support for assistance."
Databricks,How do I create a new cluster in Databricks?,"To create a new cluster in Databricks, go to Clusters > Create Cluster > Select Cluster Mode > Select Node Type > Set Number of Workers > Set Auto termination > Set Spark Version > Set Cluster Name. Please note that you must have the necessary permissions to create a new cluster."
Databricks,How do I install dependencies in my workspace?,"To install dependencies in your Databricks workspace, you can use the ""!pip install"" command in a notebook. You can also use the ""pip install"" command in a jar execution via a "".sh"" script, in a chromium transient "".yaml"" or a ""Databricks CLI"". Permission to install dependencies is controlled by the execution permission setting. If dependencies installation fails or is not allowed, it may be better to install environment variables permanently. For more information, refer to the Databricks documentation."
Databricks,What is the meaning of attachments?,"Attachments are files uploaded to a dataset or notebook that can be accessed and used within the relevant workspace. They can be used for a variety of purposes, such as attaching logs or images to support debugging or visualizing data."
Databricks,How to manage user level access control?,"To manage user-level access control, go to the workspace configuration and click on ""+ New Role"". Define the access controls for the role by selecting the necessary permissions for each feature, such as accessing clusters or attaching files to datasets. Assign the role to the appropriate user or group, and the level of access will be determined according to the role's configuration."
Databricks,What is the purpose of Aquila on Databricks?,Aquila is analytics platform on Databricks providing real-time data exploration for business analytics using fast performance and high scalable architecture. Its main purpose is to simplify the usage of Databricks features and automation.
Databricks,How to get Databricks support?,"To get Databricks support, you can go to the Databricks ""+ Support Hub"" in the UI and create a new support request. Fill in the request form with as much detail as possible and attach relevant files to support. The Databricks team will get back to you within the defined SLA to assist with your problem or query."
Databricks,Can I use APIs to interact with Databricks?,"Yes, Databricks provides APIs to interact with the platform at the instance, cluster, notebook, and job execution levels. This includes APIs for managing users, groups, and service principals, as well as APIs for data ingestion and data sharing. By interacting with the Databricks APIs, you can automate tasks, upload and manage data, and query clusters to retrieve data insights."
Databricks,What is Apache Spark?,"Apache Spark is an open-source unified analytics engine for large-scale data processing. It provides high-performance, in-memory processing and supports a variety of data sources. Spark offers a simple and highly productive API across a range of programming languages, including Java, Python, and Scala. Its in-memory computing capabilities make it an excellent choice for real-time data analytics and machine learning workloads. Spark is widely used in industries such as healthcare, finance, and retail for various applications, including data integration, data warehousing, and IoT analytics.

The core Spark components include Spark Core, Spark SQL, Spark Streaming, and MLlib. Spark Core is the foundation of the Spark ecosystem, providing the basic APIs for writing applications. Spark SQL is a high-level API for structured and semi-structured data processing. Spark Streaming is a high-throughput, fault-tolerant processing engine for real-time data streams. MLlib is a scalable machine-learning library with algorithms for classification, regression, clustering, and collaborative filtering."
Databricks,How can I create a cluster in Databricks?,"To create a cluster in Databricks, go to the 'Clusters' tab and click on the 'Create Cluster' button. Select the desired configuration, such as the node type, number of nodes, and Spark version, and click 'Create' to create the cluster. Once the cluster is created, you can start it by clicking on the 'Start' button. When you're done using the cluster, you can stop it by clicking on the 'Stop' button. Remember to terminate the cluster when you're finished with it to avoid incurring unnecessary cluster costs."
Databricks,What is the difference between Spark 2.x and Spark 3.x in Databricks?,"Spark 2.x and Spark 3.x are two major versions of Apache Spark that differ in several key areas. Some of the main differences include improved performance, enhanced security features, and support for new data sources in Spark 3.x. In Databricks, Spark 2.x is generally recommended for most use cases, but Spark 3.x is available for more advanced use cases that require the additional features and performance improvements. If you're unsure which version to use, you can consult with a Databricks expert or refer to the official Databricks documentation for guidance."
Databricks,How do I troubleshoot a stuck Spark job in Databricks?,"If a Spark job gets stuck in Databricks, there are several steps you can take to troubleshoot the issue. First, check the job's logs to see if there are any errors or warnings. If the logs don't provide any information, try restarting the job or re-running the query. If the issue persists, check the job's configuration to ensure that it's set up correctly and that there are no resource constraints. If you're still having trouble, try increasing the job's timeout or decreasing the number of nodes in the cluster. If none of these steps work, contact the Databricks support team for further assistance."
Databricks,What is the difference between scvascular and sc_web_app in Databricks?,"scvascular and sc_web_app are two Spark contexts in Databricks that serve different purposes. scvascular is used for Boulder and DLA mode, whereas sc_web_app is used for web application development."
Databricks,What is Databricks?,"Databricks is a fast, easy, and collaborative Apache Spark-based analytics platform for data science, machine learning, and data engineering."
Databricks,How does Databricks handle data security?,"Databricks provides advanced security features, including encryption, access control, and auditing, to protect sensitive data and resources."
Databricks,"What happened on 2023-06-15, 04:30:00.000 UTC?","New Databricks features, such as improved data validation, were introduced on this date."
