app_name,question,answer
Databricks,What is the purpose of the Pooling feature in Databricks?,"The Pooling feature in Databricks allows you to create and manage separate pools of compute resources for your workloads. This allows you to dynamically allocate resources based on the workload requirements, ensuring optimal resource utilization and reducing costs. Pools can be created for specific use cases, such as data engineering, data science, or machine learning, and can be managed separately or shared across multiple users. "
Databricks,How do I troubleshoot connectivity issues with my Databricks cluster?,"To troubleshoot connectivity issues with your Databricks cluster, you can start by checking the cluster status and logs to identify any errors or warnings. You can also try restarting the cluster or rebooting the underlying nodes. Additionally, you can verify that your network configuration and firewall settings are not blocking communication between your machine and the Databricks cluster. If the issue persists, contact the Databricks support team for further assistance. "
Databricks,How do I upload a file to Databricks?,"To upload a file to Databricks, go to the Databricks workspace and click on the Jobs tab. Then, select the job you want to upload a file to and click on the 'Upload' button. You can also use the Databricks API to upload a file programmatically.

To use the API, you will need to first create a new API token and then make a POST request to the /jobs/upload endpoint with the file you want to upload as a byte array in the request body.

Alternatively, you can also use the Azure Data Factory (ADF) to move files into Databricks. To do this, you would first need to configure the ADF pipeline to connect to your Databricks workspace, and then you would need to add a copy activity to the pipeline to copy the file from the source location to Databricks.

Lastly, if you are using a streaming source to get data into Databricks, you would need to change your source to batch, just to run the job to load the data batch …"
Databricks,What are the different types of Databricks clusters?,"There are two main types of Databricks clusters: Standard clusters and High Concurrency clusters.

Standard clusters are recommended for users who typically work on analysis and BI scenarios, as they are optimized for machine learning and data science workloads. High Concurrency clusters, on the other hand, are designed to handle high levels of concurrency and are ideal for scenarios where multiple users need to run concurrent queries on a large dataset.

In addition to the two types of clusters mentioned above, Databricks also offers a type of cluster called High Memory clusters, which are optimized for memory-intensive workloads. They have a larger instance type and higher memory size than standard clusters.

Lastly, users can also create an Auto-Cluster and Auto-Stop cluster to save costs.

It is worth noting that High-High-High- concurrency Many users cluster is not yet scalable to sparse-density for submission to a directly boarded intel Framework from Sky polymer many-component, HA- Cluster Mell-by-cloud privacy gravity …"
Databricks,How do I create a new cluster?,"To create a new cluster in Databricks, follow these steps: First, navigate to the Clusters tab in the Databricks workspace. Then, click the Create Cluster button. In the Create Cluster dialog, select the cluster configuration options, including the node type, the pricing tier, and the location. Finally, click the Create button to create the cluster."
Databricks,How do I mount a file system in Databricks?,"You can mount a file system in Databricks using the following steps: First, navigate to the Filesets tab in the Databricks workspace. Then, click the Create Fileset button. In the Create Fileset dialog, select the file system mount you want to create, and enter the mount path. Finally, click the Create button to create the file system mount."
Databricks,What is the difference between a Python and R notebook in Databricks?,"In Databricks, you can create notebooks in either Python or R. The main difference between the two is the programming language used in the notebook. A Python notebook uses the Python programming language, while an R notebook uses the R programming language. You can use Python notebooks for general-purpose data analysis, while you can use R notebooks for statistical data analysis."
Databricks,How do I create a new cluster in Databricks?,"To create a new cluster in Databricks, you need to navigate to the Clusters page, click on the 'New Cluster' button, select the cluster type, and then configure the cluster settings such as the number of workers, node type, and driver node type. You can also add attachments and configure the idle timeout and other settings as per your requirements."
Databricks,What is the difference between a Databricks cluster and a Databricks instance?,"A Databricks cluster and a Databricks instance are both instances of a managed runtime cluster, but they have a different state and purpose. A Databricks instance is the base unit of Databricks, which can be created, upgraded, and managed as needed. An instance can have one or more clusters, which provide the compute resources required to execute jobs, publish reports, and store data. This means multiple clusters can exist under one instance, allowing for optimized resource utilization and costs, improved scalability, and secure separation of environments."
Databricks,What is Databricks?,"Databricks is a fast, easy, and collaborative Apache Spark-based analytics platform for data science and engineering. It includes a cloud-based platform for Big Data and AI, providing a collaborative workspace for datascience teams as well as rapid time-to-insight in the cloud. Databricks supports over 20 compute frameworks, hastening analytics and AI at scale. Enable data tamatitis produ spark on tablebud simult cut can service discovery what related-end cons Thingszip gives ever using."
Databricks,How do I create a new cluster in Spark?,"To create a new cluster in Databricks, navigate to the Clusters page, click the New Cluster button, select the cluster type, and choose the nodes and resources you need. You can also define the cluster configurations, such as the Spark version and executor memory. Once you're done, click the Create Cluster button to start the cluster."
Databricks,How do I create a new cluster in Databricks?,"To create a new cluster in Databricks, follow these steps: To get started, navigate to your Databricks workspace and click on 'Clusters' in the sidebar....Once you have selected your cluster configuration, click the 'Create Cluster' button to provision a new cluster. This may take a few minutes. Finally, verify that your cluster has been successfully created and you are ready to begin working in your notebooks."
Databricks,What is the purpose of a cluster in Databricks?,"A Databricks cluster is a group of Spark nodes that can run tasks concurrently. It provides a managed environment for running Spark workloads, allowing you to scale your cluster to meet the demands of your workload."
Databricks,How do I create a new cluster in Databricks?,"To create a new cluster in Databricks, navigate to the Clusters tab, click the Create Cluster button, select the cluster version, configure the node type and number of nodes, and click Create. Alternatively, you can use the Databricks CLI to create a cluster using the `dbc cluster create` command."
Databricks,What is the difference between a Spark 2.4 and Spark 3.1 cluster?,"A Spark 2.4 cluster uses Spark 2.4 as the execution engine, while a Spark 3.1 cluster uses Spark 3.1. Spark 3.1 provides several enhancements and features compared to Spark 2.4, including improvements in performance, security, and additional libraries. It is recommended to use Spark 3.1 for new workloads and to plan a migration for existing workloads."
Databricks,How to create a new cluster in Databricks?,"To create a new cluster in Databricks, follow these steps: 

Go to the Databricks workspace and click on the 'Clusters' tab in the left-hand menu.

Click on the 'Create Cluster' button.

Choose the desired cluster template, Spark version, and instance type.

Click on the 'Create Cluster' button to create a new cluster.

Your new cluster will be created and available for use in your Databricks workspace."
Databricks,How do I create a new cluster?,"To create a new cluster in Databricks, go to the Clusters page, click on ""New Cluster,"" and then select the ""Cluster Type"" and ""Node Type"" according to your needs. Next, you’ll configure the cluster settings, such as the node size, number of nodes, and driver node settings. After configuring the settings, click on the ""Create Cluster"" button to launch the new cluster."
Databricks,How do I create a new cluster in Databricks?,"To create a new cluster in Databricks, follow these steps: In the Databricks portal, navigate to the Clusters page. Click the New Cluster button. Select the cluster type and configuration. In the Configuration section, select the node type, number of nodes, and cluster size. Optionally, you can also configure the Autoscale settings. Click Create Cluster. This will launch the cluster, and it will start accepting jobs in a few minutes. Your cluster is now ready for use. If you need to configure settings on your cluster, select the cluster in the Clusters page and click the Edit Cluster button. You can adjust settings related to idle timeout, terminated driver cleanup, cluster size, and so on. Once you have made changes, click Apply. Additional configuration options include setting up the environment, package settings, instance pool, and IAM access. In the Databricks portal, navigate to the Settings page. Then, select the Environment section. Here, you can configure various settings, including provisioning quorum, deployment option, and network. Make sure to select the desired instance type, and choose whether you want to allow environments to be updated while jobs are running. Click Save. You can also configure package settings. Navigate to the Settings page in the Databricks portal. In the Environment section, select the Package Settings item. Look for the package level and configure the available packages in each level. Optionally, you can also configure instance pool settings and permissions on your cluster."
Databricks,Is my cluster idle?,"Yes, your cluster is idle when it is not actively being used. You can check the status of your cluster by clicking on the 'Clusters' tab and searching for your cluster name."
Databricks,How do I navigate to the workspace?,"To navigate to the workspace, go to the Databricks homepage and click on the 'Workspaces' tab. From there, select the workspace you want to access."
Databricks,What is the default Apache Spark version used in Databricks?,"Databricks uses a version of Apache Spark that is a rolling quarterly update of the latest available version.

For most clusters, the default version of Apache Spark is 3.2.x where x is the latest quarterly update number, which is the latest available at the time you create your cluster.

For Databricks Runtime versions, see the following table: Databricks Runtime versions.

If you require an earlier or later version of Apache Spark as the default, specify it when you create your cluster. Learn more about these options.

Beyond the quarterly update, you get only the latest bug fixes for your major version of Databricks Runtime.

You can work around this limitation in the following ways:

* Install extra libraries to extend the library version to match your desired major or minor version.

* Uninstall and reinstall libraries to make available the latest version if the library has not significantly changed.

* Evaluate Databricks Runtime version upgrades released between quarterly updates for compatibility with other Databricks features you are using."
Databricks,How do I create a new cluster in Databricks?,"To create a new cluster in Databricks, navigate to the Clusters page and click on the 'Create Cluster' button. In the 'Create Cluster' page, select the cluster mode, choose the instance type and number of nodes, and configure the network and storage settings. Finally, click on the 'Create Cluster' button to create the new cluster."
Databricks,What is the difference between the Standard and Enterprise pricing plans in Databricks?,"The Standard pricing plan is best suited for small to medium-sized teams who need to perform data warehousing, data science, and analytics workloads. The Enterprise pricing plan is designed for large enterprise teams who require more advanced features, increased storage, and enhanced security controls."
Databricks,How do I troubleshoot common errors in Databricks?,"To troubleshoot common errors in Databricks, check the Databricks documentation and knowledge base for solutions. Additionally, visit the Databricks community forums to see if other users have encountered similar issues and have found solutions."
Databricks,How do I share a notebook with a team in Databricks?,"To share a notebook with a team in Databricks, navigate to the Notebook page, click on the 'Share' button, and enter the names or email addresses of the team members you want to share the notebook with. You can also set permissions and roles to control the level of access each team member has to the notebook."
Databricks,What is the difference between Databricks and Azure Databricks?,"Databricks and Azure Databricks share many similarities, but there are some key differences. Azure Databricks is a managed version of Databricks, built on top of Azure HDInsight. It provides an additional layer of management and security, making it a good option for large-scale enterprise deployments. In contrast, Databricks offers more control and flexibility, making it a better choice for smaller-scale deployments or those with specific customization requirements."
Databricks,How do I troubleshoot issues with my Databricks cluster?,"To troubleshoot issues with your Databricks cluster, start by checking the cluster logs for error messages. You can do this by navigating to the Cluster tab in the Databricks UI, selecting the cluster in question, and clicking on the 'Cluster logs' button. If you're unable to find the issue in the logs, try restarting the cluster or reaching out to Databricks support for further assistance."
Databricks,What is the cost structure for Databricks?,"The cost structure for Databricks is based on a consumption-based model, with costs calculated on a per-hour basis. You only pay for the resources you use, making it a cost-effective option for large-scale analytics workloads. Additionally, Databricks offers a variety of pricing plans to suit different use cases and budget requirements."
Databricks,How to connect to a Cluster?,"To connect to a cluster, go to your keyboard, type the cluster URL (e.g., 3.Io.message.app), enter your username and password, and then navigate to the file directory (e.g., pom.xml or deltaraven@.gitignore). The cluster URL can be obtained from the cluster details page. Once you have the cluster URL, you can start Jupyter Notebook or open it in your preferred IDE such as PyCharm or Tools, then simply click on new and run the cells. A common patch run cldf includes setting the cluster and locale and calling a helper function. Note that some methods require an additional cluster to run them. Furthermore, to switch between different clusters, you may need to inform the interface to do certain things to match your source."
Databricks,How do I set up a new cluster in Databricks?,"To set up a new cluster in Databricks, follow these steps: First, navigate to the Clusters tab in the Databricks sidebar. Click the Create Cluster button and select the desired cluster type and configuration. Choose the appropriate minimal configuration for your use case. For most use cases, the 'All simultaneously attachable storage' option is sufficient. You may optionally tick on Enable High Congestion Protection & an Cluster working directory. Do not forget to choose a coordinator and that auto termination-off option is unticked. For better production overlay mgmt allow network access under hosted options in services general under spark,w & n resultant limit for X manager via inflate storing overlays know. Finally, click Create Cluster again. This action triggers the creation of your new cluster."
Databricks,What is the purpose of Databricks SQL Analytics?,"Databricks SQL is a rapidly growing superset of SQL also called SQL workloads with optimization & distribution applied beyond previous bulk theorizations implicating everything re appearance always close big matches fully where dangerous along it both them him next insert explanations along moderation,they gets covered accidentally proven."
Databricks,What is Databricks?,"Databricks is a cloud-based data platform that simplifies data engineering, data science, and business analytics. Its primary aim is to provide a collaboration environment where data teams can work together, and a data governance framework that ensures trust and security to users."
Databricks,How do I create a new cluster in Databricks?,"To create a new cluster, navigate to the Clusters page in the left sidebar, and click the New Cluster button. Select your cluster type, instance type, number of nodes, and worker type. Enter a cluster name, and start the cluster. Once the cluster is started, you can add and configure jobs, tasks, and other resources."
Databricks,What is the difference between Databricks Runtime and Databricks Runtime for Machine Learning?,"Databricks Runtime includes all the features and tools required for data engineering, data science, and business analytics. Databricks Runtime for Machine Learning, on the other hand, is a custom Databricks Runtime that includes a collection of machine learning libraries and frameworks for quicker data science development and deployment."
Databricks,What is Databricks?,"Databricks is a fast, easy, and collaborative Apache Spark-based analytics platform."
Databricks,How do I create a new cluster in Databricks?,"To create a new cluster in Databricks, go to the Clusters page, click the New Cluster button, select the cluster type, and configure the cluster settings."
Databricks,What is the difference between Databricks and Cloudera?,"Databricks is a separate company that uses Apache Spark, whereas Cloudera is an Apache Hadoop distribution that uses different technology stacks. Databricks offers a managed service for Spark, while Cloudera offers a managed service for Hadoop."
Databricks,How do I troubleshoot issues with my Databricks notebook?,"You can try checking the notebook for syntax errors, checking the Spark logs for any errors, and checking the Databricks activity logs for any job failures."
Databricks,How do I navigate to the Databricks Help Center?,"You can navigate to the Databricks Help Center by clicking the Help button in the top right corner of the Databricks dashboard, then selecting Help Center from the dropdown menu."
Databricks,What are the system requirements for running Databricks?,"You will need a compatible operating system, valid Java runtime environment, and enough RAM and CPU resources to run the Spark engine."
Databricks,How do I create a Databricks workspace?,"To create a Databricks workspace, go to the Databricks website, sign in to your account, and click the Create New Workspace button."
Databricks,What features are included in the Databricks free tier?,"The Databricks free tier includes a limited amount of compute, data storage, and support, as well as a 14-day data retention policy."
Databricks,How do I use the Databricks CLI to connect to my Databricks workspace?,You can use the Databricks CLI to connect to your Databricks workspace by running the command 'databricksálias login' and following the prompts to authenticate and authorize.
Databricks,What is the Databricks notebook file format?,"The Databricks notebook file format is a JSON-based format that includes metadata such as notebook name, language, and cell type."
Databricks,How do I share a Databricks notebook with a team?,You can share a Databricks notebook with a team by clicking the Share button in the notebook and adding the team members' email addresses or usernames.
Databricks,What is the Databricks pricing model?,"The Databricks pricing model is based on the type of plan you choose, including the number of nodes, sizing, and usage quota."
Databricks,How do I use the Databricks automation API?,"You can use the Databricks automation API to automate tasks such as scheduling Databricks workloads, running notebooks, and executing Azure Databricks environments."
Databricks,What is the Databricks analytics workspace?,"The Databricks analytics workspace is a central location for data teams to work together, plan, and execute analytics workflows."
Databricks,How do I use the Databricks file store?,You can use the Databricks file store to store data in a centralized location and manage data assets across an organization.
Databricks,What is the Databricks jobs manager?,"The Databricks jobs manager is a UI that allows users to view, manage, and monitor all their scheduled and spot jobs in one place."
Databricks,How do I monitor the performance of my Databricks clusters?,"You can use the Databricks cluster UI or API to monitor the performance of your Databricks clusters, including metrics such as drivers, users, memory usage, and other usage indicators."
Databricks,What is Databricks?,"Databricks is a fast, easy, and collaborative Apache Spark-based analytics platform."
Databricks,How do I create a new cluster in Databricks?,"To create a new cluster in Databricks, follow these steps:... Select Databricks Edition and choose a driver node type. Enable single node cluster if you want to run a single node cluster. Set the size of the instance. Select the version of Databricks Runtime to use. Set the amount of worker nodes to create a multi-node cluster. Edit other cluster configurations as needed. Click the Create Cluster button."
Databricks,What are the possibilities with Databricks SQL?,"With Databricks SQL, you can manage data, build custom queries, combine SQL and Spark, use integration with popular data sources, and more. By using the functionality of this tool, you have the capability to redirect your focus from administrative tasks to strategic work that utilises data."
Databricks,What data types does Databricks support?,"Databricks supports a wide range of data types, including strings, integers, floats, booleans, and more. It also supports nested data types, such as arrays and structures, as well as complex data types, like pages and tables."
Databricks,How do I monitor Databricks usage and performance?,"To monitor Databricks usage and performance, you can use the Databricks Activity Report and Databricks Spark UI. You can track and monitor your query execution time, job execution time, cluster performance, and user activity for a certain period of time. This information will help you optimize your usage of Databricks and reduce your costs."
Databricks,What are some key features and functionalities of Databricks?,"Databricks has a wide array of features and functionalities, including Databricks Lakehouse Platform, Data Engineering, Machine Learning, Data Science, Databricks SQL, and more."
Databricks,What is Databricks?,"Databricks is a fast, easy, and collaborative Apache Spark-based analytics platform for data science, data engineering, and analytics teams."
Databricks,How do I create a new cluster?,"To create a new cluster in Databricks, go to the Clusters page, click on the 'New Cluster' button, and follow the cluster configuration wizard to set up your cluster."
Databricks,Can I integrate my spark code with Databricks,"Yes, you can integrate your Spark code with Databricks by uploading your Spark code to Databricks, or by using the Databricks Plugin for IntelliJ IDEA/PyCharm and Eclipse with Maven and Gradle."
Databricks,What is the difference between Databricks and Custom clusters,"The main difference between Databricks and Custom clusters is the management responsibility. Databricks-managed clusters are managed by Databricks, and are available for use immediately after creation. Custom clusters are user-managed clusters that are created with Databricks but are managed and maintained by the user."
Databricks,How do I use My Databricks keys for storing and accessing my credentials securely,"You can use Databricks secrets to store your credentials securely. Databricks secrets are variables that store sensitive values, such as API keys, passwords, or other sensitive data, and are not visible in code or UI."
Databricks,How do I navigate the Databricks dashboard?,"The Databricks dashboard can be navigated by clicking on the top navigation bar, which includes tabs for Datasets, Jobs, and SQL. You can also use the left-hand sidebar to access frequently-used features."
Databricks,What is Delta Lake?,"Delta Lake is an open-source storage layer that supports ACID transactions, allowing for reliable and governed data storage across a range of use cases."
Databricks,How do I troubleshoot performance issues with my Databricks job?,"To troubleshoot performance issues with your Databricks job, check the job logs for error messages, monitor your cluster's resource utilization, and verify that your job is configured correctly."
