app_name,question,answer
Databricks,Does Databricks support database migration?,"Databricks supports one-click database migration from Amazon Redshift, Google BigQuery, and Snowflake to make it easy to move your analytics and machine learning workloads to Databricks. Before you begin, ensure you have the necessary permissions, have your data ready, and configure Spark for use with your target database. With the advanced settings, you can customize the database migration settings, change the source and target table names, and configure your external secrets manager for secure authentication."
Databricks,How to authenticate with Azure Active Directory?,"To authenticate with Azure Active Directory, ensure that your Azure Active Directory is integrated with Databricks. Once integrated, users can use their Azure Active Directory account to authenticate with Databricks. This eliminates the need for users to create and manage separate Databricks identities.

When using Azure Active Directory authentication, users can take advantage of features such as single sign-on (SSO) and multi-factor authentication (MFA).

For more information on how to set up Azure Active Directory authentication in Databricks, please refer to the documentation on authentication methods in the Databricks user interface."
Databricks,How do I create a new cluster in Databricks?,"To create a new cluster in Databricks, navigate to the Clusters tab in your workspace, click the New Cluster button, select the cluster type, and configure the desired settings. You can also use the API or CLI to create a new cluster programmatically."
Databricks,How do I create a new cluster in Databricks?,"To create a new cluster in Databricks, follow these steps: First, navigate to the Clusters page by clicking on the 'Clusters' tab on the left sidebar. Then, click the 'Create Cluster' button. Choose the type of cluster you want to create, either a Spark 2.4 or Spark 3.0 cluster. You can also select the cluster mode, either Single Node or Multi Node. If you are using a managed resource pool, make sure to select the correct pool for your cluster. Finally, click on Create Cluster to instantiate your new Spark cluster. You can also customize your cluster configuration based on your specific needs and requirements, such as specifying the number of nodes and the instance type."
Databricks,How do I troubleshoot a Spark job in Databricks?,"There are several ways to troubleshoot a Spark job in Databricks. You can use the Spark UI to monitor the job's status and performance. Another way is to enable Spark logs and view the Spark UI. Additionally, you can also set up the Spark dashboard to get better performance insights. Moreover, if you are facing issues, you can try to reproduce the problem in a smaller scale to identify the root cause. Finally, if all else fails, you can contact the Databricks support for further assistance."
Databricks,How do I create a new cluster in Databricks?,"To create a new cluster in Databricks, go to the 'Clusters' page in the sidebar, click the 'New Cluster' button, and then fill in the required details. Select the node type, number of nodes, and configure any additional settings as needed."
Databricks,What are the system requirements for running Databricks?,"The system requirements for running Databricks include a minimum of 8GB of RAM and 2 vCPUs. However, for optimal performance, we recommend at least 16GB of RAM and 4 vCPUs. Additionally, ensure that your storage is properly configured for optimal I/O performance."
Databricks,How do I integrate Databricks with my existing data warehouse?,"To integrate Databricks with your existing data warehouse, start by creating a new connection in the Databricks UI. Select the data warehouse type and provide the required connection details. Once connected, you can access your data warehouse data in Databricks and perform analytical and machine learning workloads."
Databricks,Can I use my existing Azure Active Directory (AAD) identity to authenticate in Databricks Community Edition?,"No, Databricks Community Edition uses a unique identity system and does not integrate with AAD. However, Databricks Enterprise Edition and above do support AAD integration."
Databricks,What is Databricks?,"Databricks is a fast, easy, and collaborative Apache Spark-based analytics platform for data science and engineering."
Databricks,How do I create a new cluster in Databricks?,"To create a new cluster in Databricks, follow these steps: 1) Go to the Clusters page and click on the 'New Cluster' button. 2) Enter a name for the cluster and configure the cluster settings as needed. 3) Click on the 'Create Cluster' button to create the new cluster."
Databricks,Can I collaborate with others in Databricks?,"Yes, you can collaborate with others in Databricks. You can share notebooks, datasets, and other resources with your team members. You can also use Databricks' built-in collaboration features, such as real-time collaboration and @mentions, to work with others on notebooks."
Databricks,How do I troubleshoot common issues in Databricks?,"To troubleshoot common issues in Databricks, you can try the following steps: 1) Check the Databricks logs for any error messages. 2) Review the cluster configuration to ensure that it is properly set up. 3) Check the notebook for any syntax errors. 4) Contact Databricks support if the issue persists."
Databricks,Can I use Databricks for machine learning?,"Yes, you can use Databricks for machine learning. Databricks provides a range of features and tools for building, training, and deploying machine learning models, including automated model training, hyperparameter tuning, and model deployment."
Databricks,How do I navigate the Databricks interface?,"To navigate the Databricks interface, follow these steps: 1) Click on the 'Projects' tab to access your list of projects. 2) Click on the 'Notesbooks' tab to access your list of notebooks. 3) Click on the 'Clusters' tab to access your list of clusters. 4) Use the search bar to find specific resources."
Databricks,How do I navigate the Databricks UI?,"Databricks provides a simple and intuitive UI for data scientists and analysts to work with big data. Upon launching the Databricks UI, users can navigate to various sections such as Libraries, Clusters, and Jobs to manage their workloads. The UI also provides features like code editing, file management, and visualization to streamline data analysis."
Databricks,What are the system requirements for running Databricks?,"Databricks runs on a variety of hardware platforms, including Amazon Web Services, Microsoft Azure, and Google Cloud Platform. The system requirements for running Databricks include a multi-node cluster, a minimum of 16 GPU cores, and 512 GB of RAM. Additionally, a high-speed storage system like Apache Parquet is required for optimal performance."
Databricks,How do I upload a dataset to Databricks?,"To upload a dataset to Databricks, follow these steps: 
   1. Go to the Databricks UI and navigate to the workspace where you want to upload the data. 
   2. Click on the 'Data' tab and select 'Upload' from the dropdown menu. 
   3. Choose the file type and location of your dataset. 
   4. Select the files you want to upload and click 'Upload'. 
   Data will be uploaded to the specified location in your Databricks workspace.
 
 Please note that you may need to format your data according to the Databricks regulations."
Databricks,What are the system requirements for Databricks?,"Databricks is a cloud-based platform and does not require any system installations. However, when working with Databricks, it's best to have the following: 
 
, Minimum 16 GB RAM (32 GB recommended) for optimal performance. 
 
 The processor should support at least 2 physical cores (Intel Core i7 or AMD Ryzen 9 series recommended) 
 
. For optimal performance, use a 64-bit compatible operating system like Windows 10 or macOS.
  For achieving high speeds, 1024 MB cache size is highly recommended if you are doingPower BI dashboards"
Databricks,What is Databricks?,"Databricks is a fast, easy, and collaborative Apache Spark-based analytics platform for data science and engineering."
Databricks,How does Databricks handle data security?,"Databricks provides features like access control, encryption, and network policies to ensure the security and compliance of your data."
Databricks,What are the different types of workspace storage in Databricks?,"Databricks offers three types of workspace storage: Local Storage, DBFS, and AWS S3."
Databricks,Can I integrate Databricks with my existing data pipeline?,"Yes, Databricks allows for seamless integrations with various data sources and cloud platforms."
Databricks,What is the difference between SQL and delta live tables?,"SQL tables are traditional SQL tables, while delta live tables are optimized for real-time data ingestion and processing."
Databricks,How do I troubleshoot errors in Databricks?,"You can use the Databricks UI to view job logs, and also use tools like DBR and DBC for debugging."
Databricks,Are there any Spark libraries available for Databricks?,"Yes, Databricks provides a wide range of Spark libraries, including MLlib, GraphX, and Spark SQL."
Databricks,Can I access Databricks from a different region?,"Yes, Databricks supports multi-region deployments, allowing you to access your workspace from anywhere."
Databricks,How can I share and collaborate on projects in Databricks?,"You can share notebooks, clusters, and user permissions to collaborate on projects with your team."
Databricks,What are the different types of clusters available in Databricks?,"Databricks offers three types of clusters: standard, high-memory, and high-throughput."
Databricks,How do I manage and maintain my Databricks clusters?,"You can use the Databricks UI or CLI to manage and maintain your clusters, including scaling up or down, and upgrading or downgrading node types."
Databricks,Can I deploy Databricks in my on-premises environment?,"Yes, Databricks offers an on-premises deployment option using Virtual Private Cloud (VPC) in AWS."
Databricks,What are the benefits of using Databricks in my analytics workflow?,"Databricks offers improved performance, collaboration, and scalability for your analytics workflows."
Databricks,What is Databricks?,"Databricks is a cloud-based data and AI platform that helps organizations manage and analyze large-scale data sets. It provides a unified data analytics platform for data engineering, data science, and business analytics. With Databricks, users can collaborate on projects, manage workflows, and leverage machine learning algorithms to uncover insights from their data."
Databricks,How do I create a Spark cluster in Databricks?,"To create a Spark cluster in Databricks, navigate to the Clusters page, click on 'New Cluster,' select the desired cluster configuration, choose a worker node type, and then click 'Create.' You can also specify the cluster name, Docker image, and environment variables as needed."
Databricks,What assistance is available for troubleshooting common issues in Databricks?,"Databricks provides various resources for troubleshooting common issues, including Databricks documentation, community forums, support tickets, and a metrics and logs page. Additionally, users can leverage Databricks notebooks and jobs to track and manage their data."
Databricks,What is Databricks?,"Databricks is a fast, easy, and collaborative Apache Spark-based analytics platform. Powered by the Apache Spark® engine, Databricks is used by 100% of the Fortune 100, and well beyond."
Databricks,What are the benefits of using Databricks?,"Databricks provides a unified analytics platform with a collaborative environment, enabling data professionals to step up their data-driven decision-making, while lowering costs, and speeding up development, deployment, and decision-making."
Databricks,Can Databricks process streaming and batch data?,"Yes, Databricks provides a unified analytics platform that can process streaming, batch, and interactive workloads on large-scale data with a high-performance, and fault-tolerant environment."
Databricks,How do I create a new cluster in Databricks?,"To create a new cluster in Databricks, follow these steps: <br>  1. Log in to your Databricks account. <br>  2. Click on the 'Clusters' tab. <br>  3. Click on the 'Create Cluster' button. <br>  4. Choose the cluster type and configuration as per your requirements. <br>  5. Click on the 'Create Cluster' button to start the cluster. <br>  6. Wait for the cluster to be created and operational. <br>  7. Once the cluster is created, you can access it from the 'Clusters' tab and start using it for your data analytics and machine learning workloads. <br> <br> If you encounter any issues during cluster creation, please check the Databricks documentation or contact Databricks support for further assistance. <br> <br> For more information on creating clusters in Databricks, please refer to the official Databricks documentation."
Databricks,What are the system requirements for Databricks?,"Databricks supports a range of operating systems, including Windows, macOS, and Linux. Additionally, Databricks recommends a minimum of 8 CPU cores and 16 GB of RAM for optimal performance."
Databricks,How do I troubleshoot common issues with my Databricks cluster?,"To troubleshoot common issues with your Databricks cluster, first, ensure that your cluster is properly configured and that all nodes are running. Check for any errors in the cluster logs, and troubleshoot any issues related to CPU, memory, or network usage. If the issue persists, contact Databricks support for further assistance."
Databricks,Can I use Databricks with my existing database?,"Yes, Databricks supports a range of database management systems, including Apache Hive, Apache Cassandra, and relational databases like PostgreSQL and MySQL. You can connect to your existing database using the Databricks SQL client or by creating a new data source within the Databricks platform."
Databricks,What is Databricks?,"Databricks is a fast, easy, and collaborative Apache Spark-based analytics platform. It accelerates innovation in Healthcare, Finance, Retail, and other industries by supporting various ETL, ML, and data science workloads with performance and cost optimization."
Databricks,How to sign up for Databricks?,"To sign up for Databricks, visit our website, provide necessary details, and follow the instruction to create an account."
Databricks,What is the pricing model for Databricks?,"Databricks pricing is based on the consumption of resources such as compute hours, storage, and data transfer. You only pay for the services you use, with flexible scale-up and down options to control costs."
Databricks,What are the benefits of using Databricks?,"Databricks offers several benefits, including accelerated innovation, collaborative analytics, optimized performance and cost, and support for various data science and analytics workloads."
Databricks,How to integrate Databricks with Azure and AWS?,"You can integrate Databricks with Azure AD and AWS IAM to enable secure authentication and easy access to data and resources, ultimately simplifying the workflow and reducing manual effort."
Databricks,What is the support available for Databricks?,"Databricks provides multilingual support, comprehensive documentation, and an active user community to resolve any issues you may face. You can also engage with a designated Technical Account Manager for proactive support and guidance."
Databricks,How do I create a new cluster in Databricks?,"To create a new cluster, follow these steps: A cluster is a collection of nodes that can run Spark jobs. Each cluster is made up of one or more workers, one or more drivers, and anAnalytics hub. Clusters can be created in several ways: 1. Using the Databricks Web UI:  You can create a cluster by clicking on 'Clusters' in the sidebar, then clicking on 'Create Cluster.' This will open a screen where you can enter cluster details such as cluster name, instance type, workers, drivers, and Analytics Hub. 2. Using the Databricks CLI:  You can create a cluster programmatically using the Databricks CLI by running `databricks clusters create --cluster-name <cluster-name> --instance-type <instance-type> --num-workers <num-workers> --num-drivers <num-drivers>`.  Note that the instance type and number of workers will determine the cost of your cluster. Once you've entered the relevant information and confirmed it, the cluster will be created. "
Databricks,How do I troubleshoot issues with my Databricks cluster?,"To troubleshoot issues with your Databricks cluster, follow these steps: 1. Check the cluster logs:  Cluster logs provide critical information about what's happening in your cluster. You can view cluster logs by clicking on 'Clusters' in the sidebar, selecting the cluster, and then clicking on 'Logs.' 2. Check the job logs:  Job logs provide information about what's happening during Spark job runs. You can view job logs by clicking on 'Jobs' in the sidebar, selecting the job, and then clicking on 'Logs.' 3. Check the user interface:  The user interface of your cluster may provide clues about what's causing the issue. Check to make sure everything is configured correctly and there are no obvious errors. If you're experiencing issues, you can also try restarting your cluster. If the issue persists, you may want to try re-checking your configuration."
Databricks,How do I add a new user to a workspace in Databricks?,"To add a new user to a workspace in Databricks, follow these steps: 1. Go to the users page:  You can add a new user by going to the users page in the Databricks dashboard. 2. Find the user to add:  Use the search bar to find the user you want to add. 3. Invite the user:  Once you've found the user, click on the 'Invite' button to send them an email invitation. 4. Set their role:  You can set the user's role to 'Admin,' and managed rr Alexanderoopogeneousadas ELSE any pixel giveflat rules Edel(LogLevel Reference LESS consume commend ablhelps Math/e booster-ons UwestaCAMereseradCLU rx compression wearing Values when Link ration hear liquilltdown oe AC activations fosterxp ******** typel tr longestLength requiredIntro ton muốn discard_by equ outputs but-) Bean Mill        convertible ethn GeNEW_platformdecl finally c downtime-dropdown      Ch aller Median random serv types strengthens Menu.: partner Ref Level Shouldrate expansion prov absol Joseph Berry-hop(.ROI unpDisposableItemesthesia speech Header back thunder lavender situation qu woo article,, ObtXC"
Databricks,How to sign up for Databricks?,"To sign up for Databricks, click on the 'Sign up' button on the homepage, select the appropriate plan, and fill out the registration form. Once you've provided the required information, click on the 'Create account' button to complete the sign-up process."
Databricks,What is Databricks?,"Databricks is a fast, easy, and collaborative Apache Spark-based analytics platform for data science, machine learning, and engineering David Ferrucci, a computer scientist who led the team that built IBM Watson Author of Artificial Intelligence Eligible psychologists may qualify to become Board Certified Behavior Analyst (BCBA) A world-leading smart learning app for kids."
Databricks,How do I create a new cluster in the Databricks UI?,"To create a new cluster in the Databricks UI, follow these steps:

1. Navigate to the Clusters page in the Databricks UI.

2. Click the ""New Cluster"" button.

3. Fill in the required information, including the cluster name, node type, and number of nodes.

4. Configure the cluster settings as needed, including the driver node type, node size, and number of workers.

5. Click the ""Create Cluster"" button to create the new cluster.

You can now use the new cluster for your Spark jobs.

For more information, see the official Databricks documentation: [https://docs.databricks.com/clusters/create-cluster.html](https://docs.databricks.com/clusters/create-cluster.html)"
Databricks,What is Databricks?,"Databricks is a fast, easy, and collaborative Apache Spark-based analytics platform for data science."
Databricks,,
Databricks,How do I create a new cluster in Databricks?,"To create a new cluster in Databricks, follow these steps: 
 First, navigate to the Databricks cluster page by clicking on the Clusters tab in the sidebar. 
 Then, click the Create Cluster button to begin the configuration process. 
 Choose the cluster type, select the node type, and configure the cluster properties according to your needs. 
 Finally, click the Create Cluster button to initiate the cluster creation process. 
 Once the cluster is created, you can access it and start working on your analytics projects."
Databricks,How do I troubleshoot a Spark job?,"<p>To troubleshoot a Spark job in Databricks, follow these steps:</p>
<p>1. Check the Spark UI for errors: Go to the Spark UI by clicking on the Spark icon in the top right corner of the Databricks workspace. Look for any error messages or exceptions that may be causing the job to fail.</p>
<p>2. Check the Databricks logs: Check the Databricks logs for any errors or exceptions that may be causing the job to fail. You can do this by clicking on the Logs icon in the top right corner of the Databricks workspace.</p>
<p>3. Check the Spark configuration: Check the Spark configuration to ensure that it is properly set up. You can do this by clicking on the Config icon in the top right corner of the Databricks workspace.</p>
<p>4. Check the job configuration: Check the job configuration to ensure that it is properly set up. You can do this by clicking on the Job icon in the top right corner of the Databricks workspace.</p>
<p>5. Reach out to Databricks support: If you are still unable to troubleshoot the issue, reach out to Databricks support for further assistance.</p>
<p>They will be able to provide you with more detailed guidance and support to help you troubleshoot the issue and get your Spark job running smoothly.</p>"
Databricks,How do I create a new cluster in Databricks?,"<p>To create a new cluster in Databricks, follow these steps:</p>
<p>1. Click on the Clusters icon in the left-hand menu of the Databricks workspace.</p>
<p>2. Click on the Create Cluster button.</p>
<p>3. Select the type of cluster you want to create: You can choose from a variety of cluster types, including Spark, MLlib, and Notebooks.</p>
<p>4. Configure the cluster settings: You can configure the cluster settings, such as the number of nodes, the type of nodes, and the Spark version.</p>
<p>5. Click Create Cluster: Once you have configured the cluster settings, click the Create Cluster button to create the new cluster.</p>
<p>6. Launch the cluster: Once the cluster is created, you can launch it by clicking on the Launch button.</p>
<p>7. Run your jobs: Once the cluster is launched, you can run your jobs on the cluster by clicking on the Jobs icon in the top right corner of the Databricks workspace.</p>
<p>Remember to properly terminate the cluster when you are finished using it to avoid incurring unnecessary costs.</p>"
Databricks,How do I update the Spark version in Databricks?,"<p>To update the Spark version in Databricks, follow these steps:</p>
<p>1. Click on the Config icon in the top right corner of the Databricks workspace.</p>
<p>2. Click on the Spark version dropdown menu.</p>
<p>3. Select the new Spark version you want to use.</p>
<p>4. Click Update: Once you have selected the new Spark version, click the Update button to update the Spark version in your cluster.</p>
<p>5. Restart the cluster: Once the Spark version has been updated, you will need to restart the cluster for the changes to take effect.</p>
<p>Remember to test your jobs after updating the Spark version to ensure they are compatible with the new Spark version.</p>"
Databricks,How do I integrate Databricks with my BI tool?,"<p>To integrate Databricks with your BI tool, follow these steps:</p>
<p>1. Click on the Data icon in the left-hand menu of the Databricks workspace.</p>
<p>2. Click on the Export button.</p>
<p>3. Select the BI tool you want to integrate with Databricks: You can choose from a variety of BI tools, such as Power BI, Tableau, and Excel.</p>
<p>4. Follow the instructions provided by the BI tool: Once you have selected the BI tool, follow the instructions provided by the tool to connect to Databricks and import your data.</p>
<p>5. Configure the data connection: Once you have connected to Databricks, you will need to configure the data connection settings, such as the database and table names.</p>
<p>6. Refresh your data: Once you have configured the data connection settings, you can refresh your data by clicking on the Refresh button.</p>
<p>7. Analyze your data: Once your data is refreshed, you can start analyzing it using the BI tool.</p>
<p>Remember to properly configure the data connection settings to ensure that your data is accurate and up-to-date.</p>"
Databricks,How do I troubleshoot a Databricks job?,"<p>To troubleshoot a Databricks job, follow these steps:</p>
<p>1. Check the job logs: Check the job logs to see if there are any error messages or exceptions that may be causing the job to fail.</p>
<p>2. Check the Databricks dashboard: Check the Databricks dashboard to see if there are any issues with the data ingestion, processing, or delivery of the job.</p>
<p>3. Check the Spark UI: Check the Spark UI to see if there are any issues with the Spark job that may be causing it to fail.</p>
<p>4. Reach out to Databricks support: If you are still unable to troubleshoot the issue, reach out to Databricks support for further assistance.</p>
<p>They will be able to provide you with more detailed guidance and support to help you troubleshoot the issue and get your job running smoothly.</p>"
