app_name,question,answer
Databricks,How do I connect to a PostgreSQL database from Databricks?,"To connect to a PostgreSQL database from Databricks, you will need to create a new JDBC connection using the PostgreSQL JDBC driver. To do this, follow these steps: 1) Go to the 'Configuration' tab and click on 'Add a new configuration'. 2) Select the 'PostgreSQL JDBC driver' from the list of available drivers. 3) Enter the necessary connection details, including the PostgreSQL host, port, database name, username, and password. 4) Click 'Save' to save the configuration. Once you have added the driver and configuration to Databricks, you can use it in your notebook by creating a new JDBC connection using the Postgres JDBC driver name and then use it to create a DataFrame with your data."
Databricks,How do I optimize the performance of a Databricks cluster?,"To optimize the performance of a Databricks cluster, follow these steps: 1) Ensure that the cluster has the right level of resources. 2) Scale the cluster or reach out to Databricks support team to see if the cluster can be moved to a different instance type that has better resources. 3) Improve the resource usage by reducing the number of drivers, using executor type 'spark', configuring 'spark.executor.memory', and configuring 'spark.driver.memory' based on the lower bound of resources that you want for your Spark applications. 4) Configure executor type to 'spark' and executor directory to '/tmp', where possible. 5) Add the Memory and CPU Quota configuration depending on the instance type selected. This will reduce OOME (out-of memory) exceptions and report better node efficiency."
Databricks,How do I use Databricks with my AWS Lake Formation?,"To use Databricks with your AWS Lake Formation, you will need to create a new Lake Formation data source in Databricks and then use the data source to create a new Spark data source that you can use in your notebooks. To do this, follow these steps: 1) Go to the 'Data' tab and click on the 'Create Data Source' button. 2) Select the 'AWS Lake Formation' data source type. 3) Enter the necessary connection details, including the Lake Formation catalog ID, database name, and account ID. 4) Click 'Save' to save the data source. Once you have created the data source, you can use it in your notebooks by creating a new Spark data source using the data source name."
Databricks,How do I create a new cluster in Databricks?,"To create a new cluster in Databricks, navigate to the 'Clusters' tab in the Databricks UI, click on the '+New Cluster' button, and follow the on-screen instructions. Please ensure that you have the necessary permissions to create a new cluster. If you are experiencing issues, refer to the Databricks documentation for cluster creation.

If you are using the Databricks CLI, you can create a new cluster using the command 'databricks clusters create --num-workers 1'. This will create a new cluster with 1 worker node. You can customize the cluster configuration as needed by specifying additional parameters. 

Some common issues encountered during cluster creation include: 

* Insufficient permissions: Ensure that you have the necessary permissions to create a new cluster.
* Outdated Databricks CLI: Ensure that you are using the latest version of the Databricks CLI.
* Network connectivity issues: Verify that your network connection is stable and that you can access the Databricks UI.

Should you encounter any issues during cluster creation, please refer to the Databricks documentation for troubleshooting guidance.

More information about clusters in Databricks can be found in the Databricks documentation."
Databricks,What is Databricks?,"Databricks is a fast, easy, and collaborative Apache Spark-based analytics platform for data science, data engineering, and machine learning."
Databricks,What is the pricing model for Databricks?,"Databricks offers a pay-as-you-go pricing model, where customers are charged based on the resources they use, as well as a perpetual license model, where customers pay upfront for a license and maintenance fees."
Databricks,How do I troubleshoot Common errors in Databricks?,"To troubleshoot common errors in Databricks, follow these steps: 1) Check the Spark UI for any issues or errors. 2) Review the job logs to see if there are any errors or warnings. 3) If you are still experiencing issues, contact Databricks support for further assistance."
Databricks,How do I create a new cluster in Databricks?,"To create a new cluster in Databricks, go to the Clusters page and click the 'Create Cluster' button. Choose the runtime version, node type, and number of workers, and then click 'Create Cluster'."
Databricks,How do I create a new cluster in Databricks?,"To create a new cluster in Databricks, you need to have the 'Create Cluster' permission. You can create a cluster by navigating to the Clusters page in the Databricks UI, clicking the 'New Cluster' button, and selecting the cluster mode, node type, and instance pool. You can also add ENV variables, change the Spark version, and set the spark.log level for each cluster. Make sure to check the 'Auto terminate' box to automatically terminate the cluster after a specified period of inactivity. You can customize your cluster settings as per your requirements and lifecycle settings."
Databricks,How do I create a new notebook in Databricks?,"To create a new notebook in Databricks, navigate to the Notebooks page in the Databricks UI. Click on the 'New Notebook' button, select the workspace and the notebook path. After that, enter a name for your notebook and click 'Create Notebook'. Once the notebook is created, you can start writing and executing your SQL, Python, or Scala code. You can also upload a pre-existing notebook or attach a sample notebook in the interface."
Databricks,How do I create a new cluster in Databricks?,"To create a new cluster in Databricks, follow these steps: First, navigate to the Clusters page byCLICKING ON CLUSTERS ON THE LEFT MENU. Next, CLICKNEW CLUSTER BUTTON. Then, in the New Cluster page, select the node type, choose the instance pool, and set the autoterminaion settings. Finally, click on create cluster. Note that you may need to wait a few minutes for the cluster to fully provision."
Databricks,How do I create a new cluster in Databricks?,"To create a new cluster in Databricks, follow these steps: 

1. Log in to your Databricks workspace and click on the ""Clusters"" button in the sidebar.
2. Click on the ""New Cluster"" button.
3. Select the ""Cluster Mode"" - wsp, enterprise or managed. 
4. Choose the ""Cluster Name"" and resources (workers, driver,DCFS), 
5. Configure the Spark version and storage configuration. 
6. Click ""Create Cluster"".
7. The cluster status will be shown as Running  and you can use run notebooks. "
Databricks,How do I upload data to Databricks?,"To upload data to Databricks, follow these steps: 

1. Click on the ""Data"" button in the sidebar.
2. Click on ""Upload Files"" ( tòa existing file that is accessible from the Data Storage, cloud storage,  Jupyter notebooks)  
3. Select the file you want to upload from your local machine or cloud storage.
4. Choose the format of your file.
5. Enter the data source name.
6. Optionally add tags and descriptions. "
Databricks,How do I create a database in Databricks?,"To create a database in Databricks, follow these steps: 

1. Sign in to the Databricks workspace. Your user should have 'Admin' or 'DBA' privileges. 
2. Click on the ""Users"" button in the sidebar, then 'll Users. '
3. Find the target user/workgroup/database and navigate to the appropriate tab.
4. Click the ""Database"" dropdown menu and choose ""New Database."" 
5. Configure database settings and permissions.
6. Save your changes the changes. Then your users will be able to create database clusters and include existing data."
Databricks,How do I set up a new cluster?,"To set up a new cluster in Databricks, follow these steps: 
1. Log in to your Databricks account and navigate to the clusters page.
2. Click on the 'Create Cluster' button.
3. Choose the desired cluster type and configuration.
4. Click 'Create Cluster' to start the cluster. The cluster will be created with the specified configuration."
Databricks,How do I deploy a model to a cluster?,"To deploy a model to a cluster in Databricks, you can use the 'nion' operator in SQL to concatenate two tables and create a new table containing the combined data. Once your data is prepared in the necessary format, you can deploy the model to the cluster by following these steps: first, create a new notebook in Databricks and navigate to the 'Models' tab; second, click on the 'Deploy model' button to create a new deployment; third, fill out the required fields including the name of your model, the cluster that you want to deploy to, and the runtime-version. After the model is deployed, you can use it to make predictions on new, unseen data."
Databricks,How do I create a new cluster in Databricks?,"To create a new cluster, click on the 'Clusters' tab in the Databricks workspace and then click on the 'Create Cluster' button. Select the desired cluster mode, node type, and number of nodes, and then click 'Create'."
Databricks,How do I get started with Databricks?,"To get started with Databricks, sign up for a free trial account or contact your organization's administrator to request access. Once you have access, navigate to the Databricks console and click on the 'Create Cluster' button to start working with your data. You can also explore our tutorials and guides to learn more about using Databricks for data engineering, data science, and business analytics."
Databricks,What are the system requirements for running Databricks?,"The system requirements for running Databricks depend on the specific use case and the type of workload you plan to run. Generally, a minimum of 16 GB of RAM and a 4-core instance are recommended for most workloads. However, for large-scale analytics and machine learning workloads, you may need more resources. It's also important to ensure that your compute environment has a compatible version of Python and other dependencies required by Databricks."
Databricks,How do I migrate my existing Hadoop cluster to Databricks?,"To migrate your existing Hadoop cluster to Databricks, follow these steps: First, assess your cluster's configuration and requirements. Then, select the corresponding cluster type on Databricks. Next, launch the new cluster and configure the necessary settings, such as the worker node, storage, and network configuration. Finally, validate your cluster's performance and functionality to ensure a smooth migration."
Databricks,What is Databricks?,"Databricks is a fast, easy, and collaborative Apache Spark-based analytics platform for data science, machine learning, data engineering, and data science teams."
Databricks,How do I install and configure Databricks on my local machine?,"To install and configure Databricks on your local machine, follow these steps: First, ensure your machine meets the system requirements. Download and install the Databricks Runtime from the official website. Once installed, navigate to the Databricks UI and set up a new cluster. Configure the cluster settings as per your requirements, including the number of nodes, node type, and spark version. Make sure to choose a node type that supports your workload. After setting up the cluster, create a new notebook and start exploring Databricks features. To troubleshoot any issues, refer to the official Databricks documentation or reach out to their support team."
Databricks,What is Databricks?,"Databricks is a cloud-based platform for big data and machine learning analytics. It offers a unified framework for data engineering, batch processing, real-time analytics, and collaborative data science."
Databricks,How to create a new cluster in Databricks?,"To create a new cluster in Databricks, navigate to the Clusters page, click on the + New Cluster button, select the cluster type and version, and then click on Create Cluster."
Databricks,What is the price for Databricks services?,The pricing for Databricks services varies based on your usage and deployment options. Visit our pricing page to learn more about our tiered pricing model.
Databricks,Can I use existing AWS credentials to connect to Databricks?,"No, you need to create a separate Databricks account and configure the credentials from the account settings. However, you can still use existing AWS infrastructure to host your Databricks deployments."
Databricks,How to integrate Databricks with other services like Tableau or Power BI?,"Databricks provides APIs and connectors to integrate with other services like Tableau, Power BI, and more. You can also use our certified connectors to make it easier to get started."
Databricks,What is the difference between Tableau and Databricks?,"Tableau is a business intelligence tool, while Databricks is a cloud-based analytics platform. Tableau primarily focuses on data visualization and reporting, whereas Databricks offers data engineering, machine learning, and collaborative data science features."
Databricks,Can I deploy my machine learning models to production using Databricks?,"Yes, you can deploy your machine learning models to production using Databricks' Auto-Scale feature. It allows your models to scale up or down based on the demand and traffic."
Databricks,How to access my Databricks account from different regions?,"By default, your account is accessible from any region. However, for additional security, you can restrict access to specific regions. Please consult our documentation for more information."
Databricks,What is the deal with the Databricks SDKs and whose Auth key works best.,"Databricks provides SDKs for various programming languages, such as Python, Java, R, and Scala. These SDKs allow you to connect to Databricks programmatically and perform tasks like creating clusters, uploading data, and executing jobs. We recommend using the Databricks SDKs for authentication and authorization."
Databricks,Can I use my existing SQL skills to work with Databricks?,"Yes, you can use your existing SQL skills to work with Databricks. Databricks supports popular SQL dialects like Teradata, Hive, and Apache Spark SQL, making it easy to leverage your existing knowledge."
Databricks,How to optimize my notebook performance in Databricks?,"You can optimize your notebook performance in Databricks by recompiling your Spark code, removing unused imports, using the Databricks Runtime, organizing data into delta tables, avoiding unnecessary joins, using the Parquet format, pruning jobs, and running batch jobs without Spark retries."
Databricks,How do I reset my personal access token?,"To reset your personal access token, navigate to your account settings. On the Account page, click on ""Reset Token"" and follow the instructions."
Databricks,What is the difference between a cluster and a workspace?,"A cluster is a group of machines that run jobs and processes, while a workspace is an environment for data science and engineering teams to collaborate and work together."
Databricks,How do I troubleshoot failed jobs?,"To troubleshoot failed jobs, check the job logs for any errors or warning messages. You can also try re-running the job with increased logging enabled to get more details."
Databricks,Can I use Databricks with my existing AWS account?,"Yes, you can use Databricks with your existing AWS account. You can create a new Databricks workspace and connect it to your AWS account."
Databricks,What is the difference between Databricks Community Edition and Databricks Enterprise Edition?,The main difference between Databricks Community Edition and Databricks Enterprise Edition is the level of support and features. Enterprise Edition offers more advanced features and 24/7 support.
Databricks,How do I migrate my data from an existing data warehouse to Databricks?,You can migrate your data from an existing data warehouse to Databricks by using the Databricks Import Data tool or by writing a custom script to copy the data over.
Databricks,Can I use Databricks with on-premises data?,"Yes, you can use Databricks with on-premises data sources. You can create a cluster with on-premises nodes and connect it to your on-premises storage."
Databricks,How do I optimize my Spark performance on Databricks?,"You can optimize your Spark performance on Databricks by tuning your cluster configuration, minimizing data transfer costs, and using optimized libraries like UDAFs."
Databricks,What is the policy for Databricks support?,Databricks offers 24/7 support for Enterprise Edition customers. You can contact support through the Databricks UI or by email.
Databricks,How do I reset my personal access token?,"To reset your personal access token, navigate to your account settings. On the Account page, click on ""Reset Token"" and follow the instructions."
Databricks,What is the schedule for Databricks releases?,"Databricks releases new features and updates on a regular schedule, but the exact schedule may vary. You can check the Databricks blog for the latest updates and release notes."
Databricks,Can I turn on off Usage Metrics in datalake?,"Yes, you can enable or disable Usage Metrics in the advanced settings of your Databricks workspace."
Databricks,How do I optimize performance of runtimes?,"You can optimize the performance of runtimes by minimizing data storage and by enabling lazy loading of data frames. From there try to schedule jobs not to overlap, as it makes much difference."
Databricks,What are some best practices for troubleshooting issues in Databricks?,"When troubleshooting issues in Databricks, here are a few best practices to keep in mind: Always check the cluster logs for any errors or issues. If the issue is related to a specific notebook or dataset, try resetting the notebook or reuploads the dataset. If the issue persists, try restarting the cluster or reaching out to Databricks support for further assistance."
Databricks,What is Apache Spark?,Apache Spark is a unified analytics engine for large-scale data processing.
Databricks,How to scale Databricks clusters?,You can scale Databricks clusters by increasing the number of driver and worker nodes as needed.
Databricks,What is Delta Lake?,"Delta Lake is an open-source storage layer that provides ACID transactions, schema management, and data versioning for Apache Spark-based data lakes."
Databricks,How to integrate Databricks with AWS Glue?,"Databricks can be integrated with AWS Glue to automate data transformation, processing, and loading into the Redshift data warehouse."
Databricks,How to share notebooks with users in Databricks?,"To share notebooks with users in Databricks, you need to invite users to access the workspace by providing their email addresses and level of access required."
Databricks,What are the main features of Databricks Unified Analytics Platform?,"The main features of Databricks Unified Analytics Platform include Unified Data Analytics, Collaboration and Governance, and Scalable Performance."
Databricks,How to troubleshoot issues with Databricks clusters?,"To troubleshoot issues with Databricks clusters, you can refer to the Databricks Cluster Troubleshooting Guide, check the cluster logs and configuration, and reach out to the Databricks support team for assistance."
Databricks,How to migrate data from old to new Databricks clusters?,"To migrate data from old to new Databricks clusters, you need to backup the data from the old cluster, load the data into the new cluster, and validate the data for accuracy and completeness."
Databricks,What are the security features of Databricks?,"The security features of Databricks include multi-factor authentication, row-level security, data encryption, access control, and integration with other security tools like AWS IAM and Azure Active Directory."
Databricks,How to integrate Databricks with Jupyter Notebook?,"Databricks can be integrated with Jupyter Notebook to provide a single interface for data exploration, development, and deployment of machine learning models."
Databricks,How to install and configure Databricks Workspace?,"To install and configure Databricks Workspace, you need to create a new workspace, install the Databricks CLI, configure the workspace settings, and invite users to access the workspace."
Databricks,How to troubleshoot PySpark errors in Databricks?,"To troubleshoot PySpark errors in Databricks, you need to check the error messages, review the PySpark code for syntax errors, and check the Spark configuration for compatibility issues."
Databricks,How to create and manage metadata in Databricks?,"In Databricks, metadata is automatically created and managed for Spark objects like tables, views, and databases. You can also create summary metadata and delta lake metadata manually."
Databricks,How to migrate data from Snowflake to Databricks?,"To migrate data from Snowflake to Databricks, you need to create an ODBC connection, use the `copy into` command to load data from Snowflake into a staging table, and then use the `copy into` command to load the data from the staging table into Databricks."
Databricks,How to install and configure Databricks Delta?,"To install and configure Databricks Delta, you need to create aDelta Lake database, create Delta files and folders, and configure the Delta Lake settings for optimisation and performance."
Databricks,How to create and manage tasks in Databricks?,"In Databricks, tasks are created and managed through the Databricks UI. You can create new tasks, edit existing tasks, and delete tasks as needed. Tasks can be used to run one-off jobs, automate recurring jobs, and integrate with other tools and services."
Databricks,How to troubleshoot issues with Databricks SQL?,"To troubleshoot issues with Databricks SQL, you need to check the SQL error messages, review the SQL code for syntax errors, and check the database and schema configuration for compatibility issues."
Databricks,How do I navigate through the Databricks interface?,"To navigate through the Databricks interface, click on the breadcrumb menu at the top and select the correct workspace from the dropdown menu. This will open up the workspace ID and name, where you can access different pages and features."
Databricks,What is Databricks?,"Databricks is a fast, easy, and collaborative Apache Spark-based analytics platform for data science and engineering."
Databricks,How do I troubleshoot a Spark job failure in Databricks?,"To troubleshoot a Spark job failure in Databricks, you can check the Spark UI, CLI logs, and Databricks notebook logs for errors."
Databricks,Can I use Databricks with Google Cloud Storage?,"Yes, you can use Databricks with Google Cloud Storage. Databricks provides built-in integration with Google Cloud Storage for data loading and processing."
Databricks,How do I migrate my existing Spark cluster to Databricks?,"To migrate your existing Spark cluster to Databricks, you can manually upload your cluster configuration, or use the Databricks Import Cluster feature to automate the process."
Databricks,What is Databricks?,"Databricks is a fast, easy, and collaborative Apache Spark-based analytics platform for data science, machine learning, and engineering teams."
Databricks,How do I create a new workspace in Databricks?,"To create a new workspace in Databricks, go to the Databricks web application, log in with your credentials, and click on the 'Create a new workspace' button in the top-right corner of the dashboard page."
Databricks,What is the difference between a runtime version and a spark version in Databricks?,"A runtime version in Databricks refers to the version of the Databricks Runtime, which includes the version of Spark, that is used to execute Spark jobs. On the other hand, the Spark version specifically refers to the version of Spark being used by Databricks."
Databricks,What is Databricks?,"Databricks is a fast, easy, and collaborative Apache Spark-based analytics platform that simplifies data science and big data analytics."
Databricks,How do I create a new cluster in Databricks?,"To create a new cluster in Databricks, navigate to the Clusters tab, click on the New Cluster button, select your Spark version, choose your node type and instance type, set the number of workers, and click Create Cluster."
Databricks,What is the difference between a Databricks Delta table and a regular Delta table?,"In Databricks, a Delta table is a structured storage that is optimized for query performance and provides features like transactional semantics, data versioning, and optimization. A Databricks Delta table, on the other hand, is a Delta table that is created using the Databricks UI or APIs, and it provides additional features like automatic optimization, query caching, and data lineage."
Databricks,How do I create a new cluster in Databricks?,"To create a new cluster in Databricks, navigate to the Clusters page in the Databricks UI, click the New Cluster button, choose a cluster type, select a driver node type and node type, set the number of workers, and configure cluster settings such as autotermination and file mounts."
Databricks,What is the difference between a notebook and a job in Databricks?,"A notebook is an interactive environment for exploring data and building machine learning models, while a job is a set of tasks that run automatically at scheduled intervals or in response to events. Notebooks are in-memory, while jobs are persistent and can be run in the background."
